filename,notes,authors,licenses,urls
"body/bodies/male/walk.png","see details at https://opengameart.org/content/lpc-character-bases; 'Thick' Male Revised Run/Climb by JaidynReiman (based on ElizaWy's LPC Revised)","bluecarrot16, JaidynReiman, Benjamin K. Smith (BenCreating), Evert, Eliza Wyatt (ElizaWy), TheraHedwig, MuffinElZangano, Durrani, Johannes Sjölund (wulax), Stephen Challener (Redshrike)","OGA-BY 3.0, CC-BY-SA 3.0, GPL 3.0","https://opengameart.org/content/liberated-pixel-cup-lpc-base-assets-sprites-map-tiles, https://opengameart.org/content/lpc-medieval-fantasy-character-sprites, https://opengameart.org/content/lpc-male-jumping-animation-by-durrani, https://opengameart.org/content/lpc-runcycle-and-diagonal-walkcycle, https://opengameart.org/content/lpc-revised-character-basics, https://opengameart.org/content/lpc-be-seated, https://opengameart.org/content/lpc-runcycle-for-male-muscular-and-pregnant-character-bases-with-modular-heads, https://opengameart.org/content/lpc-jump-expanded, https://opengameart.org/content/lpc-character-bases"
"head/heads/human/male/walk.png","original head by Redshrike, tweaks by BenCreating, modular version by bluecarrot16","bluecarrot16, Benjamin K. Smith (BenCreating), Stephen Challener (Redshrike)","OGA-BY 3.0, CC-BY-SA 3.0, GPL 3.0","https://opengameart.org/content/liberated-pixel-cup-lpc-base-assets-sprites-map-tiles, https://opengameart.org/content/lpc-character-bases"
"hat/helmet/barbuta/male/walk.png","","bluecarrot16","OGA-BY 3.0, CC-BY 3.0, CC-BY 4.0, GPL 2.0, GPL 3.0","https://opengameart.org/content/lpc-helmets, https://opengameart.org/content/lpc-expanded-hats-facial-helmets"
"arms/armour/plate/male/walk.png","original by wulax, recolors by bigbeargames; adapted to v3 bases and further recolors by bluecarrot16, climb/emote by JaidynReiman","Michael Whitlock (bigbeargames), Matthew Krohn (makrohn), Johannes Sjölund (wulax), bluecarrot16, JaidynReiman","OGA-BY 3.0, CC-BY-SA 3.0, GPL 3.0","https://opengameart.org/content/lpc-medieval-fantasy-character-sprites, http://opengameart.org/content/lpc-clothing-updates"
"torso/clothes/longsleeve/longsleeve/male/walk.png","original by wulax; tweaks and further recolors by bluecarrot16; cleanup and climb/jump/run/sit/emote/revised combat adapted from LPC Revised by JaidynReiman","JaidynReiman, Johannes Sjölund (wulax)","OGA-BY 3.0, CC-BY-SA 3.0, GPL 3.0","https://opengameart.org/content/lpc-medieval-fantasy-character-sprites, http://opengameart.org/content/lpc-clothing-updates, https://opengameart.org/content/lpc-revised-character-basics, https://github.com/ElizaWy/LPC/tree/main/Characters/Clothing, https://opengameart.org/content/lpc-expanded-sit-run-jump-more, https://opengameart.org/content/lpc-expanded-simple-shirts"
"torso/armour/plate/male/walk.png","original by wulax, recolor by bigbeargames, color reduced to 7 colors and adapted to v3 bases by bluecarrot16, run/jump/sit/climb/revised combat by JaidynReiman, reduced colors to 6 (based on Napsio's Vitruvian)","Napsio (Vitruvian Studio), JaidynReiman, bluecarrot16, Michael Whitlock (bigbeargames), Johannes Sjölund (wulax)","OGA-BY 3.0, CC-BY-SA 3.0, GPL 3.0","https://opengameart.org/content/lpc-medieval-fantasy-character-sprites, https://opengameart.org/content/lpc-combat-armor-for-women"
"feet/armour/plate/male/walk/gold.png","original by wulax, recolors by bigbeargames, edits for v3 base and recolors by bluecarrot16","Matthew Krohn (makrohn), Johannes Sjölund (wulax)","OGA-BY 3.0, CC-BY-SA 3.0, GPL 3.0","https://opengameart.org/content/lpc-medieval-fantasy-character-sprites"
"feet/socks/high/male/walk/black.png","original overalls and thin socks by ElizaWy, base animations adapted from v3 overalls by bluecarrot16, socks by JaidynReiman","JaidynReiman, ElizaWy, Bluecarrot16, Stephen Challener (Redshrike), Johannes Sjölund (wulax)","OGA-BY 3.0, GPL 3.0","https://github.com/ElizaWy/LPC/tree/main/Characters/Clothing, https://opengameart.org/content/lpc-expanded-socks-shoes"
"hat/accessory/plumage_centurion/adult/walk.png","","bluecarrot16, DCSS authors","CC0","http://opengameart.org/content/dungeon-crawl-32x32-tiles, https://opengameart.org/content/cc0-headgear-icons, https://opengameart.org/content/lpc-helmets-mega-pack, https://opengameart.org/content/lpc-expanded-hats-facial-helmets"
"cape/solid/female/walk/forest.png","","bluecarrot16, JaidynReiman","OGA-BY 3.0, CC-BY-SA 3.0, GPL 3.0","https://opengameart.org/content/lpc-curly-hair-elven-ears-white-cape-with-blue-trim-and-more, https://opengameart.org/content/lpc-roman-armor, http://opengameart.org/content/lpc-clothing-updates"
"cape/solid_behind/walk/forest.png","","Nila122, JaidynReiman","OGA-BY 3.0, CC-BY-SA 3.0, GPL 3.0","https://opengameart.org/content/lpc-curly-hair-elven-ears-white-cape-with-blue-trim-and-more, https://opengameart.org/content/lpc-roman-armor"
"legs/armour/plate/male/walk.png","reduced to 7 colors an adapted to v3 bases by bluecarrot16, climb/jump/sit/emotes by JaidynReiman","bluecarrot16, JaidynReiman, Michael Whitlock (bigbeargames), Matthew Krohn (makrohn), Johannes Sjölund (wulax)","OGA-BY 3.0, CC-BY-SA 3.0, GPL 3.0","https://opengameart.org/content/lpc-medieval-fantasy-character-sprites"
"arms/hands/gloves/male/walk.png","metal gloves by wulax, recolors by bigbeargames, adapted to v3 bases by bluecarrot16, added to expanded animations by JaidynReiman","Michael Whitlock (bigbeargames), Matthew Krohn (makrohn), Johannes Sjölund (wulax), bluecarrot16, JaidynReiman","OGA-BY 3.0, CC-BY-SA 3.0, GPL 3.0","https://opengameart.org/content/lpc-medieval-fantasy-character-sprites, http://opengameart.org/content/lpc-clothing-updates"
"weapon/polearm/spear/foreground/walk/gold.png","original by wulax, walk animations redone by pvigier, split into layers and tweaked for v3 character bases by bluecarrot16","Pierre Vigier (pvigier), Johannes Sjölund (wulax), Inboxninja","CC-BY-SA 3.0","https://opengameart.org/content/lpc-medieval-fantasy-character-sprites, https://opengameart.org/content/lpc-spear-and-shovel-reworked"
"torso/jacket/tabard/male/walk/forest.png","original by wulax, edited to v3 base by bluecarrot16","bluecarrot16, Johannes Sjölund (wulax)","OGA-BY 3.0, CC-BY-SA 3.0, GPL 3.0","https://opengameart.org/content/lpc-medieval-fantasy-character-sprites, http://opengameart.org/content/lpc-clothing-updates"
